{
  "kind": "test",
  "machine": "ChatSession",
  "name": "a second answer to a closed request is discarded and the journal remembers it",
  "start_at": 1000,
  "steps": [
    {"do": "feed", "event": {"kind": "signal", "name": "user_message", "input": "hi"}, "expect": {"state": "Awaiting"}},
    {"do": "feed", "event": {"kind": "progress", "name": "agent_chunk", "request": "agent-1", "input": "x"}, "expect": {"state": "Awaiting"}},
    {"do": "feed", "event": {"kind": "answer", "name": "agent_done", "request": "agent-1"}, "expect": {"state": "Done", "outcome": "answer:x"}},
    {"do": "feed", "event": {"kind": "answer", "name": "agent_done", "request": "agent-1"}, "expect": {"state": "Done", "journal": [], "outcome": "answer:x", "sent": ["agent-1"]}}
  ]
}
