{
  "kind": "test",
  "machine": "Batch",
  "name": "a set of no names: the fork Split sends the machine to the end at once, no request is sent",
  "start_at": 1000,
  "steps": [
    {"do": "feed", "event": {"kind": "start", "input": {"names": []}, "request": "up-1"}, "expect": {"state": "Done", "outcome": "answer:0", "sent": [], "open": []}}
  ]
}
