{
  "kind": "test",
  "machine": "Router",
  "name": "Mode.B goes to Beta, the size 50 is large",
  "start_at": 1000,
  "steps": [
    {"do": "feed", "event": {"kind": "start", "input": {"mode": {"$variant": "Mode", "name": "B", "fields": {}}, "size": 50}}, "expect": {"state": "Large", "outcome": "answer:beta:large", "journal": [{"code": "measured", "params": {"verdict": "large"}}]}}
  ]
}
