{
  "kind": "test",
  "machine": "caller",
  "name": "a call: the nested machine has answered; a stop of a human reaches the parent after the answer was taken and the parent has ended: nothing is passed",
  "start_at": 1000,
  "steps": [
    {
      "do": "feed",
      "event": {
        "kind": "start",
        "request": "up-1",
        "input": {
          "task": "t"
        }
      },
      "expect": {
        "state": "Call",
        "journal": [],
        "open": [
          "callee-1"
        ],
        "sent": [
          "callee-1"
        ],
        "queue": [],
        "outcome": "none",
        "data": {
          "call_request_id": "up-1",
          "child_attempt": 1,
          "open_requests": [
            "callee-1"
          ]
        }
      },
      "also": {
        "callee-1": {
          "state": "Ask",
          "open": [
            "agent-1"
          ],
          "sent": [
            "agent-1"
          ],
          "queue": [],
          "outcome": "none",
          "data": {
            "label": "t",
            "count": 3,
            "profile": "fast",
            "call_request_id": "callee-1",
            "agent_attempt": 1,
            "open_requests": [
              "agent-1"
            ]
          }
        }
      }
    },
    {
      "do": "feed",
      "event": {
        "kind": "answer",
        "request": "agent-1",
        "input": "hi"
      },
      "on": "callee-1",
      "expect": {
        "state": "Done",
        "journal": [
          {
            "code": "callee_answered",
            "params": {
              "label": "t"
            }
          }
        ],
        "open": [],
        "outcome": "answer:{\"$record\":\"CallOutput\",\"fields\":{\"answer\":\"hi\",\"score\":3}}"
      },
      "also": {
        "parent": {
          "state": "Call",
          "queue": [
            "in answer"
          ],
          "outcome": "none"
        }
      }
    },
    {
      "do": "pump",
      "expect": {
        "state": "Done",
        "journal": [
          {
            "code": "child_answered",
            "params": {
              "answer": "hi",
              "score": "3"
            }
          }
        ],
        "open": [],
        "queue": [],
        "outcome": "answer:hi"
      }
    },
    {
      "do": "feed",
      "event": {
        "kind": "signal",
        "name": "human_stop",
        "input": {
          "human_word": "stop",
          "author": "ann",
          "source": "console"
        }
      },
      "expect": {
        "state": "Done",
        "outcome": "answer:hi"
      },
      "also": {
        "callee-1": {
          "state": "Done"
        }
      }
    }
  ]
}
